ID_avtorja,avtor,kraj_rojstva,leto_rojstva31280,Eugene B. Sledge,"in Mobile, Alabama, The United States",1923
31367,Samuel Eliot Morison,"in Boston, Massachusetts, The United States",1887
31425,Ben Okri,"in Minna, Nigeria",1959
31457,James Dickey,"in Atlanta, Georgia, The United States",1923
31707,Ernest Thompson Seton,"in South Shields, County Durham , The United Kingdom",1860
31726,Marc Reisner,"in Minneapolis, The United States",1948
31845,Marge Piercy,"in Detroit, Michigan, The United States",1936
32005,Harold Robbins,"in New York, The United States",1916
32498,Iris Johansen,"in St. Louis, Missouri",
32507,Akira Kurosawa,"in Setagaya, Tokyo, Japan",1910
32530,B. Traven,Germany,
32549,W.P. Kinsella,"in Edmonton, Alberta, Canada",1935
32587,Bryan Burrough,,1961
32590,Anthony Horowitz,"in Stanmore, Middlesex, The United Kingdom",
32594,Jeph Loeb,"in Stamford, Connecticut, The United States",1958
32595,Koushun Takami,"in Amagasaki, Hyōgo Prefecture, Osaka, Japan",1969
32807,Romain Gary,"in Vilnius , Lithuania",1914
32878,Michel Houellebecq,,
33017,Tom Sharpe,"in London, The United Kingdom",1928
33384,Taylor Caldwell,"in Manchester, The United Kingdom",1900
33404,Fernando Vallejo,"in Medellin, Colombia",1942
33472,Mika Waltari,"in Helsinki, Finland",1908
33503,L. Ron Hubbard,"in Tilden, Nebraska, The United States",1911
33918,China Miéville,"in Norwich, England, The United Kingdom",
33987,LaVyrle Spencer,"in Browerville, Minnesota, The United States",1943
33998,Edna St. Vincent Millay,"in Rockland, Maine, The United States",1892
34336,Anne Carson,"in Toronto, Ontario, Canada",1950
34660,Richard Atwater,"in Chicago IL, The United States",1892
34878,Walter Moers,,
35007,William Horwood,"in Oxford, The United Kingdom",1944
35201,Mark Achbar,,
35245,Carmen Laforet,"in Barcelona, Spain",1921
35258,Yukio Mishima,"in Tokyo, Japan",1925
35332,Larry Collins,"in Hartford, Connecticut, The United States",1929
35822,Tony Kushner,"in New York, New York, The United States",1956
36122,Patricia C. Wrede,"in Chicago, The United States",1953
36332,John Wyndham,"in Knowle, Warwickshire, The United Kingdom",1903
36378,Amin Maalouf,"in Beirut, Lebanon",1949
36686,Luther Blissett,,
36714,Frederick Forsyth,"in Ashford, Kent, England, The United Kingdom",1938
36746,Lemony Snicket,"in San Francisco, The United States",
36808,Carlo Levi,"in Turin, Italy",1902
36812,Claire Huchet Bishop,,
36910,Langston Hughes,"in Joplin, Missouri, The United States",1902
36913,Rabindranath Tagore,"in Calcutta, India",1861
37086,Karin Boye,"in Gothenburg, Sweden",1900
37218,Edward Abbey,"in Indiana, Pennsylvania, The United States",1927
37708,Andrew S. Grove,in Hungary,1936
37728,Frantz Fanon,in Martinique,1924
37766,Gary Jennings,"in Buena Vista, Virginia, The United States",1928
37848,Alberto Moravia,"in Via Sgambati, Rome, Italy",1907
37871,José Donoso,"in Santiago, Chile",1924
38185,Mary Renault,"in London, England, The United Kingdom",1905
38266,Selma Lagerlöf,"in Mårbacka, Värmland, Sweden",1858
38285,C.G. Jung,"in Kesswil, Thurgau, Switzerland",1875
38329,Heinrich Harrer,,
38343,Sean Covey,"in Belfast, Ireland, The United Kingdom",1964
38697,Nick Cave,"in Warracknabeal, Victoria, Australia",1957
38706,Italo Svevo,,
38951,John Connolly,"in Dublin, Ireland",
38968,P.C. Hodgell,"in Des Moines, Iowa, The United States",1951
39087,Miguel Ángel Asturias,"in Guatemala City, Guatemala",1899
39237,Jamaica Kincaid,"in St. Johns, Antigua and Barbuda",1949
39263,Manuel Mujica Láinez,"in Buenos Aires, Argentina",1910
39279,Juan Carlos Onetti,"in Montevideo, Uruguay",1909
39326,Heinrich Böll,"in Cologne, Germany",1917
39349,Ariel Dorfman,"in Buenos Aires, Argentina",1942
39402,Patrick Süskind,"in Ambach, Bavaria, Germany",1949
39621,Sandra Gulland,"in Miami, The United States",
40098,Luke Rhinehart,"in Albany, New York, The United States",1932
40311,Piers Paul Read,"in Beaconsfield, Buckinghamshire, The United Kingdom",1941
40351,Henry Lincoln,"London, The United Kingdom",
40398,Arturo Pérez-Reverte,"in Cartagena, Murcia, Spain",1951
40416,Amélie Nothomb,"in Etterbeek, Belgium",1966
40552,Jan Karon,"in Lenoir, North Carolina, The United States",1937
40737,Daniel Pennac,"in Casablanca, Morocco",1944
41013,Farley Mowat,"in Belleville, Canada",1921
41108,Paulo Freire,"in Recife, Brazil",1921
41121,Alan Sillitoe,"in Nottingham, The United Kingdom",1928
41193,Sara Donati,"Chicago, The United States",
41313,Susan Elizabeth Phillips,,
41469,Oswald Chambers,"in Aberdeen, Scotland, The United Kingdom",1874
41495,Romain Rolland,"in Clamecy, Nièvre, France",1866
41534,Alfred Jarry,"in Laval, France",1873
41542,Helen Dunmore,"in Yorkshire, The United Kingdom",1952
41588,Elizabeth Bishop,"in Worcester, Massachusetts, The United States",1911
41616,Friedrich Dürrenmatt,"in Konolfingen, Switzerland",1921
41938,Robert  Stone,"in Brooklyn, The United States",1937
41963,Neil Postman,"in New York, New York, The United States",1931
41992,Jerome Lawrence,"in Cleveland, OH, The United States",1915
42017,Barbara Shook Hazen,,
42041,Max Weber,"in Erfurt, Germany",1864
42288,Clyde Edgerton,"in Durham, North Carolina, The United States",1944
42353,Carol O'Connell,"in  New York City, The United States",1947
42354,Margaret Laurence,"in Neepawa, Canada",1926
42464,Samad Behrangi,"in Tabriz, Iran",1939
42697,Irma S. Rombauer,"in St. Louis, Missouri, The United States",1877
42920,Wallace Stevens,"in Reading, Pennsylvania, The United States",1879
42927,Mercè Rodoreda,"in Barcelona, Spain",1908
43127,Allan Bloom,"in Indianapolis, Indiana, The United States",1930
43274,Adrian Conan Doyle,in The United Kingdom,1910
43298,Yevgeny Zamyatin,"in Lebedian, Russian Federation",1884
43443,Dee Brown,"in Alberta, LA, The United States",1908
43602,Harriette Simpson Arnow,"in Bronston, KY, The United States",1908
43613,Nevada Barr,"in Yerington, Nevada, The United States",1952
43665,Bruce Chatwin,"in Sheffield, The United Kingdom",1940
43828,Aldo Leopold,"in Burlington, Iowa, The United States",1887
44003,Katharine Kerr,"in Cleveland, Ohio, The United States",
44023,Josephine Tey,"in Inverness, Scotland, The United Kingdom",1896
44037,Vernor Vinge,"in Waukesha, Wisconsin, The United States",1944
44061,Thornton Wilder,"in Madison, Wisconsin, The United States",1897
44150,Federico García Lorca,"in Fuente Vaqueros, Granada, Spain",1898
44202,Mikhail Sholokhov,"in Veshenskaya, Russian Federation",1905
44545,Oakley Hall,"in San Diego, The United States",1920
44694,Harry Mulisch,"in Haarlem, Netherlands",1927
45191,Karleen Koen,"New York City, The United States",
45230,Tove Jansson,"in Helsinki, Finland",1914
45531,Charles Baxter,"in Minneapolis, The United States",1947
45645,Sherwood Anderson,"in Camden, Ohio, The United States",1876
45706,Alfred Döblin,"in Szczecin, Poland",1878
45712,Katherine Mansfield,"in Wellington, New Zealand",1888
45752,Isaiah Berlin,"in Riga, Latvia",1909
46158,Marjorie Kinnan Rawlings,"in Washington, DC, The United States",1896
46204,Arlene Mosel,"in Cleveland, Ohio, The United States",1921
46228,Jim Goad,"in Philadelphia, Pennsylvania, The United States",1961
46810,Murray N. Rothbard,"in Bronx, New York, The United States",1926
46882,Sanaya Roman,The United States,
47104,Melina Marchetta,"Sydney, Australia",
47118,Nicholas Monsarrat,"in Liverpool, England, The United Kingdom",1910
47391,Patrick McCabe,"in Clones, County Monaghan, Ireland",1955
47406,W. Michael Gear,"in Colorado Springs, Colorado, The United States",1955
47421,Dino Buzzati,"in San Pellegrino, Italy",1906
47499,Paullina Simons,"Leningrad, Russian Federation",
47640,Nancy Garden,"in Boston, The United States",1938
47687,Barbara Vine,in The United Kingdom,1930
48143,Annemarie Selinko,in Austria,1914
48206,Karen Marie Moning,"in Cincinnati, Ohio, The United States",
48298,Lin Yutang,"in Banzi, China",1895
48305,Cornelius Ryan,"in Dublin, Ireland",1920
49111,Samuel R. Delany,"in New York City, The United States",1942
49326,Guillermo Cabrera Infante,"in Gibara, Cuba",1929
49756,Luis Buñuel,"in Calanda, Spain",1900
49757,Joseph Kessel,"in Villa Clara, Argentina",1898
49930,Herbert Marcuse,"in Berlin, Germany",1898
49941,Alan Furst,"in New York City, The United States",1941
50071,Bohumil Hrabal,"in Brno, Czech Republic",1914
50416,Fay Weldon,"in Alvechurch, England, The United Kingdom",1931
50524,Misha Glenny,,
50782,Antonia White,"in London, England, The United Kingdom",1899
50783,Patrick White,"in Knightsbridge, London, England, The United Kingdom",1912
50786,Elizabeth Goudge,"in Wells, The United Kingdom",1900
50873,L.J. Smith,"in Fort Lauderdale, Florida, The United States",1904
50948,Mickey Spillane,"in Brooklyn, New York City, The United States",1918
51204,Alastair Reynolds,"in Barry, Wales, The United Kingdom",1966
51229,John  Williams,"in Clarksville, Texas, The United States",1922
51289,James Lincoln Collier,"in New York City, New York, The United States",1928
51424,James Howe,"in Oneida, New York, The United States",1946
51484,Paul Zindel,"in New York, The United States",1936
51503,Fredric Brown,"in Cincinnati, Ohio, The United States",1906
51563,Ahdaf Soueif,"in Cairo , Egypt",1950
51575,Colette,,
51589,Chitra Banerjee Divakaruni,,
51606,L.P. Hartley,"in Whittlesey, Cambridgeshire, The United Kingdom",1895
51724,Constantinos P. Cavafis,"in Alexandria, Egypt",1863
51808,Vicente Huidobro,"in Santiago, Chile",1893
52070,John Neufeld,"in Chicago, The United States",1938
52074,John Crowley,"in Presque Isle, Maine, The United States",1942
52285,Frank Stanford,"in Richton, The United States",1948
52310,Joanna Russ,"in New York, New York, The United States",1937
52601,N.H. Kleinbaum,in The United States,1948
52627,Olive Ann Burns,"in Banks County, Georgia, The United States",1924
52683,Jorge Amado,,
52776,Christie Dickason,,
53088,Patrick McDonnell,,
53259,Stella Gibbons,"in London, The United Kingdom",1902
53353,Katharine Weber,"in New York City, The United States",1955
53501,George R. Stewart,"in Sewickley, Pennsylvania, The United States",1895
53559,Katsuhiro Otomo,"in Hasama, Japan",1954
53665,Lewis Grassic Gibbon,,
54103,Jean Giono,,
54133,André Breton,"in Tinchebray, France",1896
54354,Robert Merle,"in Tebessa, Algeria",1908
54711,Janell Cannon,"in St. Paul, Minnesota, The United States",1957
54761,Miles Davis,"in Alton, Illinois, The United States",1926
55111,David Henry Hwang,"in Los Angeles, California, The United States",1957
56700,Crockett Johnson,in The United States,1906
57189,Dylan Thomas,"in Swansea, Wales, The United Kingdom",1914
57432,Franz Werfel,"in Prague, Bohemia, Czech Republic",1890
57461,Elizabeth Haydon,in The United States,1965
57502,Cheryl Richardson,,
57925,Assata Shakur,"in Jamaica, Queens, New York, The United States",1947
58411,Keith Waterhouse,"in Leeds, West Yorkshire, England, The United Kingdom",1929
58634,Kamala Markandaya,"in Chimakurti, India",1924
58917,Eiji Yoshikawa,"in Kanagawa prefecture, Japan",1892
58918,Helene Hanff,"in Philadelphia, The United States",1916
58971,Joe R. Lansdale,"in Gladewater, Texas , The United States",1951
59027,Caroline Alexander,,
59060,John Steakley,"in Cleburne, Texas, The United States",1951
59542,Peter Benchley,"in New York, New York, The United States",1940
59910,Frank Conroy,"in New York, The United States",1936
60177,Guy Gavriel Kay,"in  Weyburn, Saskatchewan, Canada",
60281,Sogyal Rinpoche,"Trehor, Kham, Tibet",
60609,Eve Ensler,"in Scarsdale, New York, The United States",1953
61088,Esther Freud,"in London, The United Kingdom",1963
61105,Dr. Seuss,"in Springfield, MA, The United States",1904
61128,Antonis Samarakis,"in Athens, Greece",1919
62110,Paul Brickhill,"in Melbourne, Victoria, Australia",1916
62421,Miroslav Krleža,"in Zagreb, Croatia",1893
62707,Shunryu Suzuki,"in Kanagawa Prefecture, Japan",1904
63523,Alfred Korzybski,"in Warsaw, Poland",1879
63564,André Malraux,"in Paris, France",1901
63659,Barbara Erskine,"in Nottingham, The United Kingdom",1944
63693,Ferrol Sams,"in Fayette County, Georgia, The United States",1922
63898,Julia Quinn,"New York City, NY, The United States",
64177,Olaf Stapledon,"in Seacombe, Wallasey, Cheshire, England, The United Kingdom",1886
64280,Ludwig Bemelmans,,
64456,Antonio Tabucchi,"in Pisa, Italy",1943
64525,Gerald Seymour,"in Guildford, Surrey, The United Kingdom",1941
64625,Tatyana Tolstaya,"in St. Petersburg, Russia, Russian Federation",1951
64654,Sheila Burnford,in The United Kingdom,1918
64941,Donald Ervin Knuth,"in Milwaukee, The United States",1938
65685,Nathanael West,"in New York City, The United States",1903
65974,Leon Trotsky,"in Kherson, Ukraine",1879
66037,Eliyahu M. Goldratt,,
66162,Charles Tazewell,"in Des Moines, Iowa, The United States",1900
66186,Harry Allard,"in Evanston, Illinois, The United States",1928
66314,W.J. Cash,,
66522,Guillaume Apollinaire,"in Rome, Italy",1880
67388,Forrest Carter,"in Anniston, Alabama, The United States",1925
68189,Emil M. Cioran,"in Răşinari, Romania",1911
68481,Nawal El-Saadawi,"in Kafr Tahla, Egypt",1931
68809,John Gunther,"in North Side, Chicago, Illinois, The United States",1901
69007,Beatrice Sparks,"in Goldburg, Idaho, The United States",1918
70177,Joan Slonczewski,"in Hyde Park, New York, The United States",
70180,Hal Clement,"in Somerville, Massachusetts, The United States",1922
70540,Ivan Doig,"in White Sulphur Springs, Montana, The United States",1939
70692,Tayeb Salih,,
70940,Hella S. Haasse,"in Batavia, Indonesia",1918
70993,Michael Bond,"in Newbury, Berkshire, England, The United Kingdom",1926
71955,Arthur Hailey,"in Luton, Bedfordshire, England, The United Kingdom",1920
71956,Javier Marías,"in Madrid, Spain",1951
72039,Roberto Bolaño,"in Santiago, Chile",1953
72183,Jonathan Weiner,,
72237,Lynne Reid Banks,"in London, England, The United Kingdom",1929
72703,Samuel Butler,"in Bingham, Nottinghamshire, England, The United Kingdom",1835
73021,Booth Tarkington,"in Indianapolis, Indiana, The United States",1869
73494,Jean Lee Latham,"in Buckhannon, West Virginia, The United States",1902
73812,Jack McDevitt,in The United States,1935
74248,Radclyffe Hall,,
74263,John Rawls,"in Baltimore, The United States",1921
74531,Helen Lester,"in Evanston, Illinois, The United States",1936
74572,Katherine Anne Porter,"in Indian Creek, Texas, The United States",1890
74649,Maria D. Wilkes,,
74899,Thomas Pakenham,"in London, The United Kingdom",1933
75091,Fred Gipson,"in Mason, TX, The United States",1908
75287,Jean-Dominique Bauby,"in Paris, France",1952
76172,Ernesto Che Guevara,"in Rosario, Santa Fe, Argentina",1928
76241,Cesare Pavese,"in Santo Stefano Belbo, Italy",1908
76328,Christina Stead,"in Rockdale, New South Wales, Australia",1902
76405,Loretta Chase,,
77023,Taro Gomi,"in Tokyo, Japan",1945
77193,Helen Prejean,"in Baton Rouge, Louisiana, The United States",1939
78755,Margaret Davidson,,
79095,Claude Brown,,
79431,Ernest Holmes,,
80824,Milorad Pavić,"in Belgrade, Serbia",1929
80892,Frank O'Hara,"in Baltimore, Maryland, The United States",1926
80984,James Herbert,"in London, England, The United Kingdom",1943
81466,A.A. Milne,"in Hampstead, London, England, The United Kingdom",1882
81570,Gene Kranz,"in Toledo, Ohio, The United States",1933
81675,Lewis Thomas,,1913
82608,Rafael Sabatini,"in Jesi, Italy",1875
82705,Roy  Lewis,"in Felixstowe, The United Kingdom",1913
82937,James Stephens,"in Dublin, Ireland",1880
82974,Julius Evola,"in Rome, Italy",1898
83846,Margery Williams Bianco,"in London, England, The United Kingdom",1881
83925,Anita Rau Badami,"in Rourkela, Odisha, India",1961
85288,Benedict Freedman,"in New York, The United States",1919
86098,Clarice Lispector,"in Tchetchelnik, Ukraine",1920
86404,E.M. Forster,"in Marylebone, London, England, The United Kingdom",1879
86801,John Ashbery,"in Rochester, New York",1927
86808,John Berryman,"in McAlester, Oklahoma, The United States",1914
87683,Jamie Simons,,
87735,Bess Streeter Aldrich,"in Cedar Falls, Iowa, The United States",1881
87937,Horace McCoy,"in Pegram, Tennessee, The United States",1897
88420,Andrey Kurkov,"in Budogoszcz, Russian Federation",1961
88445,Kathleen E. Woodiwiss,"in  Alexandria, Louisiana, The United States",1939
88483,Oswald Spengler,"in Blankenburg, Germany",1880
88922,Kenneth Oppel,"Port Alberni, British Columbia, Canada",
89330,Pär Lagerkvist,"in Växjö, Småland, Sweden",1891
89552,Munro Leaf,"in Hamilton, Maryland, The United States",1905
89863,Tillie Olsen,"in Wahoo, Nebraska, The United States",1912
90796,Jerry Mander,in The United States,1936
90820,Robert Olen Butler,"in Granite City, Illinois, The United States",
91236,Maggie O'Farrell,"Coleraine, Ireland",
92064,Paul Gallico,"in New York, NY, The United States",1897
92665,James Branch Cabell,"in Richmond, Virginia, The United States",1879
92805,Constantin Virgil Gheorghiu,"in Valea Albă, Romania",1916
92881,Helen Hooven Santmyer,"in Cincinnati, Ohio, The United States",1895
92974,Gervase Phinn,"in Rotherham, South Yorkshire, The United Kingdom",1946
93351,Michelle Magorian,"in Portsmouth, The United Kingdom",1947
93353,Abraham Verghese,"in Adis Ababa, Ethiopia",1955
94301,Theodor W. Adorno,"in Frankfurt, Germany",1903
94775,Gerda Weissmann Klein,,
95370,Sharon Dennis Wyeth,"Washington D.C., The United States",
95937,João Guimarães Rosa,"in Cordisburgo, Brazil",1908
95947,Vilhelm Moberg,"in Moshultamåla, Småland, Sweden",1898
97436,César Vallejo,"in Santiago de Chuco, Peru",1901
98909,Owen Wister,"in Germantown, outside Philadelphia, , The United States",1860
99473,Edith Pargeter,"in Horsehay, Shropshire, The United Kingdom",1913
99703,Anna Akhmatova,,
99849,Esther Forbes,"in Westborough, Massachusetts , The United States",1891
100672,Raymond Murphy,,
101823,Pramoedya Ananta Toer,,
102203,Corrie ten Boom,"in Amsterdam, Netherlands",1892
104015,Barbara Pym,"in Oswestry, Shropshire, The United Kingdom",1913
104728,William Peter Blatty,"in New York, New York, The United States",1928
106463,Jay Anson,"in New York, The United States",1921
107130,William Strauss,,
107638,Albert Cohen,"in Corfu, Greece",1895
108940,Patrick Dennis,"in Evanston, Illinois, The United States",1921
112402,Rose Macaulay,"in Rugby, The United Kingdom",1881
112892,Jim Lovell,"in Cleveland, Ohio, The United States",1928
113561,Osamu Dazai,,
113844,Elizabeth Marie Pope,in The United States,1917
114539,Mordecai Richler,"in Montreal, Canada",1931
114722,Spike Milligan,"in Ahmednagar, India",1918
115317,Miss Read,,
117182,Susan Faludi,,
117775,William H. Armstrong,in The United States,1911
117788,Michael Swan,The United Kingdom,
118391,Xavier Herbert,"in Port Hedland, WA, Australia",1901
121072,Janet E. Morris,in The United States,
121407,Mo Yan,"in Gaomi, Shandong province, China",1955
122479,Erich von Däniken,"in Zofingen, Switzerland",1935
122798,Ben Hamper,"Flint, Michigan, The United States",
123023,Glenway Wescott,"in Kewaskum, Wisconsin, The United States",1901
123715,Agatha Christie,"in Torquay, Devon, England, The United Kingdom",1890
123866,Roland Topor,"in Paris, France",1938
124613,Slavenka Drakulić,"in Rijeka, Croatia",1949
127676,Danilo Kiš,"in Subotica, Serbia",1935
127901,Lloyd C. Douglas,"in Columbia City, Indiana, The United States",1877
128382,Leo Tolstoy,"in Yasnaya Polyana, Tula, Russian Empire",1828
128499,Irving Wallace,"in Chicago, Illinois, The United States",1916
128607,Elfriede Jelinek,"in Mürzzuschlag, Styria, Austria",1946
128947,Marlen Haushofer,,
130272,Charles Palliser,in The United States,1947
130766,Robert Bolt,"in Sale, Cheshire, The United Kingdom",1924
132350,Joy Adamson,,
133522,Tadeusz Borowski,,
134770,Ágota Kristóf,"in Csikvánd, Hungary",1935
136007,Andrew Holleran,in The United States,1944
137261,Barbara W. Tuchman,"in New York, New York, The United States",1912
138426,W. Cleon Skousen,"in Raymond, Alberta, Canada",1913
139372,Robert Brody,,
139434,Oğuz Atay,"in İnebolu, Kastamonu, Turkey",1934
142899,Bruno Schulz,,
146538,Siegfried Sassoon,"in Matfield, Kent, England, The United Kingdom",1886
148413,Patrick Leigh Fermor,"in London, The United Kingdom",1915
150701,Jack Schaefer,"in Cleveland, Ohio, The United States",1907
153350,Brian W. Kernighan,"in Toronto, Ontario, Canada",1942
154550,Ayi Kwei Armah,,
155517,Italo Calvino,"in Santiago de Las Vegas, Cuba",1923
157249,William Wharton,"in Philadelphia, Pennsylvania, The United States",1925
157527,Fred Uhlman,"in Stuttgart, Germany",1901
157779,Wallace Stegner,"in Lake Mills, Iowa, The United States",1909
158380,Ann Fairbairn,"in Cambridge, Massachusetts",1905
160932,Robert B. Cialdini,in The United States,
161460,Bill Knott,"Carson City, Michigan, The United States",
162541,Amy Scholder,The United States,
164153,Hisaya Nakajo,"in Osaka, Japan",1973
164170,Harun Yahya,"in Ankara, Turkey",1956
167265,Ian Macdonald,in The United Kingdom,1948
167395,Alex Kava,The United States,
171515,Georg Trakl,"in Salzburg, Austria",1887
174213,Cookie Mueller,"in Baltimore, MD, The United States",1949
174592,Vera Bouteneff,,
176217,B.H. Liddell Hart,"in Paris, France",1895
179733,Kathleen Duey,,
182839,Tom Brown Jr.,"in Toms River, New Jersey, The United States",1950
183491,Amanda Foreman,"in London, The United Kingdom",1968
183575,Murray Bail,"in Adelaide, SA, Australia",1941
184683,Willem Frederik Hermans,"in Amsterdam, Netherlands",1921
188737,Barry Hines,"in Hoyland, England, The United Kingdom",1939
191636,Graciliano Ramos,,
192188,Robert Mawson,,
193170,Spencer W. Kimball,"in Salt Lake City, Utah, The United States",1895
204351,Melba Pattillo Beals,,
209672,Charles M. Schulz,"in Minneapolis, MN, The United States",1922
209681,Chingiz Aitmatov,"in Sheker, Kyrgyzstan",1928
213094,Bruce Benderson,The United States,
214546,G.I. Gurdjieff,"in Alexandropol , Armenia",1872
215502,Leigh Nichols,,
217192,Raoul Vaneigem,"in Lessines Hainaut, Belgium, Belgium",1934
227026,Hans Fallada,"in Greifswald, Germany",1893
229241,Stanley Ellin,"in Brooklyn, New York, The United States",1916
230318,Erskine Childers,"in Mayfair, Middlesex, The United Kingdom",1870
233619,Marcel Proust,"in Auteuil, France",1871
245393,Heimito von Doderer,,
245448,William Craig,"Concord, Massachusetts, The United States",
248844,Richard Paige,,
249165,Freya Littledale,"New York City, The United States",
250725,Eric Sloane,"in New York, N.Y.",1905
260713,Jan Guillou,in Sweden,1944
261742,William March,"in Mobile, Alabama, The United States",1893
261784,Gregory McDonald,"in Shrewsbury, Mass., The United States",1937
262262,Felix Salten,"in Budapest, Hungary",1869
262916,Anna Seghers,"in Mainz, Germany",1901
271029,Bernice Morgan,,
274225,Anna Lee Waldo,"in Great Falls, Montana, The United States",1925
281443,Ernst Jünger,"in Heidelberg, Germany",1895
292578,Elsa Morante,"in Rome, Italy",1912
294526,Vassilis Vassilikos,in Greece,1934
295074,Linda Yablonsky,,
295289,Richard Hughes,"in Weybridge, Surrey, The United Kingdom",1900
296340,Clint Catalyst,,
296961,Paul Auster,"in Newark, New Jersey, The United States",1947
302660,Hjalmar Söderberg,"in Stockholm, Sweden",1869
305908,Leo Marks,in The United Kingdom,1920
311800,Carlos Drummond de Andrade,,
318835,Odysseus Elytis,"in Heraklion, Crete, Greece",1911
320625,ایرج پزشک زاد,,
327218,Steve Eddy,,
331826,Urantia Foundation,"in Chicago, The United States",1950
338068,Robert Tressell,"in Dublin, Ireland",1870
341311,Jay Wright,,
345873,Joan Lindsay,"in St. Kilda, Australia",1896
346732,George R.R. Martin,"in Bayonne, New Jersey, The United States",1948
348111,Maulana Wahiduddin Khan,"in Badharia, India",
349707,Karl Popper,"in Vienna, Austria",1902
352751,Raymond Murray,,
367338,Nelson Mandela,"in Mvezo, South Africa",1918
368349,Danielle Willis,,
369288,Peter Høeg,"in Copenhagen, Denmark",1957
386595,عباس معروفی,,
387955,Susan Coolidge,"in Cleveland, Ohio, The United States",1835
396497,Traci Harding,"in Carlingford New South Wales, Australia",
410653,Astrid Lindgren,"in Vimmerby, Småland, Sweden",1907
426944,T.H. White,"in Bombay, India",1906
431149,Truman Capote,"in New Orleans, Louisiana, The United States",1924
435477,Shel Silverstein,"in Chicago, IL, The United States",1930
439723,Karel Čapek,"in Malé Svatoňovice, Czech Republic",1890
443003,P.C. Wren,"in Deptford, London, England",1875
449547,H.G. Bissinger,"in New York City, The United States",1954
458276,P. Sainath,India,
458937,Lesley Pearse,,
468569,Winifred Watson,"in Newcastle upon Tyne, The United Kingdom",1906
481146,John Gardner,"in Batavia, New York, The United States",1933
502766,Mariama Bâ,"in Dakar, Senegal",1929
516526,Jon R. Luoma,,
516921,Gloria E. Anzaldúa,"in Rio Grande Valley, Texas , The United States",1942
537334,Muhammad Mohar Ali,Bangladesh,
563720,O.E. Rølvaag,"in Dønna, Nordland, Norway",1876
598299,A.M. Homes,"in Washington, D.C., The United States",1961
599584,K. Eric Drexler,"Alameda, CA, The United States",
608211,Robin Waterfield,The United Kingdom,
615182,Annie M.G. Schmidt,"in Kapelle, Netherlands",1911
617033,Alexandra David-Néel,,
626222,Anita Diamant,"New York City, The United States",
